{
  "schemaName": "sdd-review.review-report",
  "schemaVersion": 1,
  "changeName": "source-row-first-security-review",
  "artifactKind": "canonical-review-report",
  "generatedAt": "2026-07-11T00:20:00Z",
  "sourceCatalogRef": "skills/sdd-review/references/review-control-catalog.json",
  "sourceCatalogSnapshotId": "sdd-review-control-catalog-2026-07-10-rev-corp-001-096",
  "derivedMarkdownRef": "openspec/changes/source-row-first-security-review/review-report.md",
  "verdict": "PASS WITH WARNINGS",
  "blockingFailureCount": 0,
  "nonBlockingFindingCount": 2,
  "nextRecommended": "review-security",
  "inputsInspected": [
    {"artifact": "proposal", "ref": "openspec/changes/source-row-first-security-review/proposal.md", "readable": true, "notes": "Confirmed source-row-first intent, compact-control removal, exporter scope, and success criteria."},
    {"artifact": "spec", "ref": "openspec/changes/source-row-first-security-review/specs/sdd-review-security-workflow/spec.md", "readable": true, "notes": "Confirmed canonical sourceRowValidation.rows requirements and compact-control removal scenarios."},
    {"artifact": "spec", "ref": "openspec/changes/source-row-first-security-review/specs/sdd-security-guideline-catalog/spec.md", "readable": true, "notes": "Confirmed 155-row catalog inventory, source-row grouping, and safe evidence requirements."},
    {"artifact": "spec", "ref": "openspec/changes/source-row-first-security-review/specs/sdd-execution-persistence-contracts/spec.md", "readable": true, "notes": "Confirmed verify/archive consume canonical JSON summaries and must not duplicate matrices."},
    {"artifact": "spec", "ref": "openspec/changes/source-row-first-security-review/specs/canonical-review-json-excel-exporter/spec.md", "readable": true, "notes": "Confirmed exporter default table path and pytest expectations."},
    {"artifact": "design", "ref": "openspec/changes/source-row-first-security-review/design.md#secure-development-design", "readable": true, "notes": "Confirmed security-impacting classification, safe evidence policy, artifact authority, and exporter risk boundaries."},
    {"artifact": "test-design", "ref": "openspec/changes/source-row-first-security-review/test-design.md", "readable": true, "notes": "Confirmed TD/NA/MD/PY cases and unavailable-tooling carry-forward expectations."},
    {"artifact": "tasks", "ref": "openspec/changes/source-row-first-security-review/tasks.md", "readable": true, "notes": "All planned apply tasks 1.1 through 4.4 are checked complete."},
    {"artifact": "apply-progress", "ref": "openspec/changes/source-row-first-security-review/apply-progress.md", "readable": true, "notes": "Cumulative slice evidence records source-row contract, downstream propagation, and Python exporter test results."},
    {"artifact": "changed-files", "ref": "git status --short / apply-progress.md#files-changed", "readable": true, "notes": "Changed-file context inspected through launch status, git status, and apply evidence; no implementation files were modified during review."}
  ],
  "runtimeChecks": {
    "testRunner": {"available": true, "command": "python -m pytest python/tests", "evidence": "Executed during review: 20 passed in 0.90s on Python 3.12.6 / pytest 9.1.1."},
    "build": {"available": false, "command": "none detected", "evidence": "openspec/config.yaml and apply-progress.md report no global build runner for this repository."},
    "coverage": {"available": false, "command": "none detected", "evidence": "No global coverage runner detected; not claimed as passing evidence."},
    "linter": {"available": false, "command": "none detected", "evidence": "No global linter detected; git diff --check passed with line-ending normalization warnings only."},
    "typeChecker": {"available": false, "command": "none detected", "evidence": "No global type checker detected; not claimed as passing evidence."},
    "formatter": {"available": false, "command": "none detected", "evidence": "No global formatter detected; not claimed as passing evidence."},
    "commandsExecuted": ["python -m pytest python/tests", "git status --short", "git diff --stat", "git diff --check"],
    "unavailableToolingNote": "Repository-wide build, coverage, lint, type-check, and format commands are unavailable; Python exporter tests are available and passed. Unavailable tooling is carried as warning evidence only."
  },
  "blockingSummary": [],
  "evidenceSummary": {
    "summary": "Apply evidence is coherent with proposal/spec/design/test-design/tasks. All apply tasks are complete, Python exporter tests passed, and source-row-first contract evidence is ready for dedicated security review.",
    "items": [
      "Tasks 1.1-4.4 are complete in openspec/changes/source-row-first-security-review/tasks.md.",
      "Apply evidence records three bounded slices: security-review contract, downstream/shared/agent propagation, and Python exporter/tests/README.",
      "Review confirmed active security-review skill/reference files no longer contain compactControlValidation, SEC-* authority markers, compactGuidelines, compactMapping, or Compact Control sections.",
      "Review confirmed shared, verify, archive, and agent wrappers consume canonical sourceRowValidation.rows summaries/refs without copying or re-scoring the matrix.",
      "python -m pytest python/tests passed with 20 tests, including sourceRowValidation.rows default, compact-only default failure, workbook read-back, safe CLI errors, and README assertions."
    ]
  },
  "operationalEvidenceSummary": {
    "summary": "Operational impact is limited to repository artifacts, generated reports, and optional workbook exports. No production runtime, hostnames, logs, payloads, credentials, or workbook bytes are required or recorded.",
    "items": [
      "Safe evidence uses paths, section anchors, sanitized summaries, command outcomes, and unavailable-tooling statements only.",
      "No generated .xlsx files were found in the repository; exporter tests use temporary output paths.",
      "README warns that the exporter does not sanitize unsafe source JSON and generated workbooks should not be committed as ordinary artifacts.",
      "Global build/lint/type/format/coverage tooling remains unavailable and is not treated as passing evidence."
    ]
  },
  "changedFileSecurityHandoff": {
    "summary": "Security handoff should proceed to sdd-review-security. General review confirms the implementation removed active compact-control authority and prepared source-row-first evidence; exhaustive 155-row validation remains owned by review-security.",
    "items": [
      "Security-review schema/catalog/template/rules changed under skills/sdd-review-security/ and now declare sourceRowValidation.rows as the only active matrix.",
      "skills/_shared/*, skills/sdd-verify/SKILL.md, skills/sdd-archive/SKILL.md, and agents/sdd/* were propagated to consume canonical JSON summaries/refs only.",
      "python/json_report_to_excel.py defaults sdd-review-security.review-security-report to sourceRowValidation.rows; python/tests and python/README.md align with that default.",
      "Review-security must validate exact-once 155 Source IDs, row evidence, N/A justifications, unsafe evidence rejections, exceptions, and JSON/Markdown parity before verify."
    ]
  },
  "reviewMatrix": [
    {"item":"REV-CORP-001","sourceItem":1,"category":"code-quality","artifactDeliverable":"Estándares de Nomenclatura","requirement":"naming standards","reviewer":"sdd-review","standard":"Estándar de Diseño y Código WEB","severity":"Media","complies":"Yes","affectedRequirement":"proposal.md#success-criteria; tasks.md#completed-tasks","evidenceLocation":"apply-progress.md#files-changed","observationsComments":"Changed files preserve existing repository naming conventions; no blocker found.","findingType":"none"},
    {"item":"REV-CORP-002","sourceItem":2,"category":"code-quality","artifactDeliverable":"Folder structure","requirement":"folder structure per platform standard","reviewer":"sdd-review","standard":"Estándar de Diseño y Código WEB","severity":"Media","complies":"Yes","affectedRequirement":"design.md#file-changes; apply-progress.md#files-changed","evidenceLocation":"skills/sdd-review-security/, skills/_shared/, agents/sdd/, python/","observationsComments":"Implementation stayed in planned folders and OpenSpec change folder; no blocker found.","findingType":"none"},
    {"item":"REV-CORP-003","sourceItem":3,"category":"code-quality","artifactDeliverable":"Service names","requirement":"service names comply with area naming standards","reviewer":"sdd-review","standard":"Estándar de Diseño y Código WEB","severity":"Media","complies":"Yes","affectedRequirement":"design.md#file-changes","evidenceLocation":"changed-file context from git status --short","observationsComments":"No service/runtime names were introduced; changed skill/agent/script names follow existing project conventions.","findingType":"none"},
    {"item":"REV-CORP-004","sourceItem":4,"category":"code-quality","artifactDeliverable":"Developer testing","requirement":"developer tested code/unit use cases","reviewer":"sdd-review","standard":"Estándar de Diseño y Código WEB","severity":"Mayor","complies":"Yes","affectedRequirement":"test-design.md#python-exporter-pytest-coverage; apply-progress.md#commands-run","evidenceLocation":"python -m pytest python/tests -> 20 passed","observationsComments":"Python exporter test evidence is current and passed during review.","findingType":"none"},